{
  "schema_version": 1,
  "original_conjecture": "Does a concrete σ-complete orthomodular lattice carry a σ-essential state? The current programme conjectures no; bounded or finite evidence must not be reported as resolving this question.",
  "claims": {
    "BANK-3CFB7B249E": {"statement": "The amended orthomodular-poset form has a zero-sorry Lean certificate.", "category": "banked_result", "status": "accepted", "scope": "As stated; evidence classes remain distinct.", "evidence_class": "lean", "evidence": [], "supersedes": null, "introduced_by": "e9fde9f003ad51eff559f52a3683a752ab7f8552", "last_reviewed_by": null},
    "BANK-4D0B60AB25": {"statement": "The two-fibre atom-selector class is closed: jointly coherent pairs have disjoint propagation support, rectangular compatibility, and identity monodromy.", "category": "banked_result", "status": "accepted", "scope": "As stated; evidence classes remain distinct.", "evidence_class": "research_state", "evidence": [], "supersedes": null, "introduced_by": "e9fde9f003ad51eff559f52a3683a752ab7f8552", "last_reviewed_by": null},
    "BANK-DB3202D23A": {"statement": "Several finite relay and short-loop architectures have been classified or killed; these are finite/executable evidence unless separately hand-proved or formalized.", "category": "banked_result", "status": "accepted", "scope": "As stated; evidence classes remain distinct.", "evidence_class": "executable_or_finite", "evidence": [], "supersedes": null, "introduced_by": "e9fde9f003ad51eff559f52a3683a752ab7f8552", "last_reviewed_by": null},
    "BANK-C20EB7B6FC": {"statement": "Hand-proof lemma: in an OML, Boolean blocks containing the same compatible pair e,f generate the same embedded Boolean subalgebra from e,f.", "category": "banked_result", "status": "accepted", "scope": "As stated; evidence classes remain distinct.", "evidence_class": "hand_proof", "evidence": [], "supersedes": null, "introduced_by": "fe55102b7a9e626d05b95802fc3cdb527ba01f02", "last_reviewed_by": "run-0004"},
    "BANK-C9B4D936FC": {"statement": "Executable finite result: in the fixed seven-block skeleton, O2 and O3 repeat one intrinsic four-region datum across their two common blocks; the associated duplicate-edge constraints reduce to one pullback.", "category": "banked_result", "status": "accepted", "scope": "As stated; evidence classes remain distinct.", "evidence_class": "executable_or_finite", "evidence": [], "supersedes": null, "introduced_by": "fe55102b7a9e626d05b95802fc3cdb527ba01f02", "last_reviewed_by": "run-0004"},
    "BANK-EB24200119": {"statement": "O2/O3 repeated-common-block candidates do not produce two inequivalent quotient edges merely from multiple blocks containing the same selector pair.", "category": "banked_result", "status": "accepted", "scope": "As stated; evidence classes remain distinct.", "evidence_class": "research_state", "evidence": [], "supersedes": null, "introduced_by": "fe55102b7a9e626d05b95802fc3cdb527ba01f02", "last_reviewed_by": "run-0004"},
    "BANK-031DBD089A": {"statement": "Hand-proof lemma: if common embedded Boolean subalgebras jointly generate each of two Boolean blocks in an OML, then the blocks coincide.", "category": "banked_result", "status": "accepted", "scope": "As stated; evidence classes remain distinct.", "evidence_class": "hand_proof", "evidence": [], "supersedes": null, "introduced_by": "dd083e7c2b57166a25379f4f531aa72171a5bcdb", "last_reviewed_by": "run-0005"},
    "BANK-74BDA17364": {"statement": "Finite executable result: the four-point P/Q versus P/R control has two inequivalent edge relations whose intersection is the permutation [0,1,3,2], while both overlap families jointly generate their endpoints.", "category": "banked_result", "status": "accepted", "scope": "As stated; evidence classes remain distinct.", "evidence_class": "executable_or_finite", "evidence": [], "supersedes": null, "introduced_by": "dd083e7c2b57166a25379f4f531aa72171a5bcdb", "last_reviewed_by": "run-0005"},
    "BANK-F3F755394B": {"statement": "The minimal four-point jointly-generating distinct-event-family transverse square cannot realize two distinct maximal Boolean blocks; its canonical collapse is a wholly central 16-element Boolean algebra.", "category": "banked_result", "status": "accepted", "scope": "As stated; evidence classes remain distinct.", "evidence_class": "executable_or_finite", "evidence": [], "supersedes": null, "introduced_by": "dd083e7c2b57166a25379f4f531aa72171a5bcdb", "last_reviewed_by": "run-0005"},
    "CLOSED-1E861D7D4B": {"statement": "Naive product-Ulam and atom-selector routes do not yield the required lattice witness.", "category": "closed_architecture", "status": "accepted", "scope": "As stated; evidence classes remain distinct.", "evidence_class": "research_state", "evidence": [], "supersedes": null, "introduced_by": "e9fde9f003ad51eff559f52a3683a752ab7f8552", "last_reviewed_by": null},
    "CLOSED-DEB2F4FCF4": {"statement": "Direct finite repeater candidates fail one or more of latticehood, σ-completeness, global state extension, or σ-state order separation.", "category": "closed_architecture", "status": "accepted", "scope": "As stated; evidence classes remain distinct.", "evidence_class": "executable_or_finite", "evidence": [], "supersedes": null, "introduced_by": "e9fde9f003ad51eff559f52a3683a752ab7f8552", "last_reviewed_by": null}
  },
  "open_gate": "Resolve a transverse-overlap architecture whose inequivalent overlap families have proper joint Boolean closure in at least one endpoint, with mixed completion, latticehood, σ-completeness, maximal blocks, centre, state extension, and order separation checked independently.",
  "formalization_boundary": "The joint-generation collapse lemma is a hand proof and the four-point controls are finite executable evidence. Existing Lean files still do not certify the open OML conjecture or a general transverse-overlap classification.",
  "next_task": "Construct the smallest proper-joint-closure transverse candidate and audit its full mixed completion and structural gates.",
  "controlling_files": ["CLAUDE.md", "notes/taxonomies_index.json", "notes/programme/program_overview.md", "notes/programme/frontier_map.md", "notes/programme/shovel_plan.md", "notes/open_questions/oml_attack/oml_lattice_taxonomy.json", "notes/open_questions/oml_attack/oml_lattice_regularity_attack.md", "formalization/QuerySystem/"],
  "scope_qualifications": "Finite approximants, Python receipts, hand proofs, executable evidence, and Lean theorems are distinct evidence classes. No bounded census establishes an infinite classification. The centre, σ-completeness, latticehood, and maximal-block behavior remain explicit gates for proposed witnesses.",
  "accepted_commit": "dd083e7c2b57166a25379f4f531aa72171a5bcdb"
}
